title,author,generes,page_count,publisher,comb
attack on titan: volume 1,Hajime Isayama,none,192.0,Kodansha Comics,attack on titan: volume 1 Hajime Isayama none Kodansha Comics
antiques roadkill: a trash 'n' treasures mystery,Barbara Allan,"Fiction , Mystery &amp, Detective , Cozy , General",288.0,Kensington Publishing Corp.,"antiques roadkill: a trash 'n' treasures mystery Barbara Allan Fiction , Mystery &amp, Detective , Cozy , General Kensington Publishing Corp."
the art of super mario odysse,Nintendo,"Games &amp, Activities , Video &amp, Electronic",368.0,Dark Horse Comics,"the art of super mario odysse Nintendo Games &amp, Activities , Video &amp, Electronic Dark Horse Comics"
getting away is deadly: an ellie avery myster,Sara Rosett,none,320.0,Kensington Publishing Corp.,getting away is deadly: an ellie avery myster Sara Rosett none Kensington Publishing Corp.
the painted man ,Peter V. Brett,"Fiction , Fantasy , Dark Fantasy",544.0,HarperCollins UK,"the painted man  Peter V. Brett Fiction , Fantasy , Dark Fantasy HarperCollins UK"
a feast for crows,George R.R. Martin,none,864.0,HarperCollins UK,a feast for crows George R.R. Martin none HarperCollins UK
god of war: the official novelization,J.M. Barlog,"Fiction , Media Tie-In",400.0,Titan Books,"god of war: the official novelization J.M. Barlog Fiction , Media Tie-In Titan Books"
edgedancer: from the stormlight archive,Brandon Sanderson,"Fiction , Fantasy , Epic",226.0,Tor Books,"edgedancer: from the stormlight archive Brandon Sanderson Fiction , Fantasy , Epic Tor Books"
"blood, sweat, and pixels: the triumphant, turbulent stories behind how video games are made",Jason Schreier,"Games &amp, Activities , Video &amp, Electronic",304.0,HarperCollins,"blood, sweat, and pixels: the triumphant, turbulent stories behind how video games are made Jason Schreier Games &amp, Activities , Video &amp, Electronic HarperCollins"
twas the nightshift before christmas: festive hospital diaries,Adam Kay,"Biography &amp, Autobiography , Medical (incl. Patients)",112.0,Pan Macmillan,"twas the nightshift before christmas: festive hospital diaries Adam Kay Biography &amp, Autobiography , Medical (incl. Patients) Pan Macmillan"
sword of destiny: witcher 2: tales of the witcher,Andrzej Sapkowski,"Fiction , Fantasy , Dragons &amp, Mythical Creatures",400.0,Hachette UK,"sword of destiny: witcher 2: tales of the witcher Andrzej Sapkowski Fiction , Fantasy , Dragons &amp, Mythical Creatures Hachette UK"
the mysterious affair at styles ,Agatha Christie,none,208.0,HarperCollins UK,the mysterious affair at styles  Agatha Christie none HarperCollins UK
riley paige mystery bundle: once gone (#1) and once taken (#2)and once craved (#3),Blake Pierce,none,250.0,Blake Pierce,riley paige mystery bundle: once gone (#1) and once taken (#2)and once craved (#3) Blake Pierce none Blake Pierce
deadpool kills the marvel universe,Cullen Bunn,"Comics &amp, Graphic Novels , Superheroes",96.0,Marvel Entertainment,"deadpool kills the marvel universe Cullen Bunn Comics &amp, Graphic Novels , Superheroes Marvel Entertainment"
the red signal: an agatha christie short story,Agatha Christie,none,40.0,HarperCollins UK,the red signal: an agatha christie short story Agatha Christie none HarperCollins UK
crossroads of twilight: book ten of 'the wheel of time,Robert Jordan,"Fiction , Fantasy , Epic",704.0,Tor Fantasy,"crossroads of twilight: book ten of 'the wheel of time Robert Jordan Fiction , Fantasy , Epic Tor Fantasy"
my little pony: friendship is magic ,Thom Zahler,"Comics & Graphic Novels , Fantasy",30.0,IDW Publishing,"my little pony: friendship is magic  Thom Zahler Comics & Graphic Novels , Fantasy IDW Publishing"
that time i got reincarnated as a slime 1,Story by FUSE,none,208.0,Kodansha America LLC,that time i got reincarnated as a slime 1 Story by FUSE none Kodansha America LLC
ask a footballer,James Milner,"Biography &amp, Autobiography , Sports",320.0,Hachette UK,"ask a footballer James Milner Biography &amp, Autobiography , Sports Hachette UK"
sonic the hedgehog ,Ian Flynn,"Comics & Graphic Novels , Science Fiction",32.0,IDW Publishing,"sonic the hedgehog  Ian Flynn Comics & Graphic Novels , Science Fiction IDW Publishing"
ultimate spider-man vol. 11: carnage,Brian Michael Bendis,none,144.0,Marvel Entertainment,ultimate spider-man vol. 11: carnage Brian Michael Bendis none Marvel Entertainment
prince of thorns ,Mark Lawrence,"Fiction , Classics",416.0,HarperCollins UK,"prince of thorns  Mark Lawrence Fiction , Classics HarperCollins UK"
influence: the psychology of persuasion,"Robert B. Cialdini, PhD","Business &amp, Economics , Motivational",336.0,Harper Collins,"influence: the psychology of persuasion Robert B. Cialdini, PhD Business &amp, Economics , Motivational Harper Collins"
introducing critical theory: a graphic guide,Stuart Sim,"Social Science , General",176.0,Icon Books,"introducing critical theory: a graphic guide Stuart Sim Social Science , General Icon Books"
tall tales and wee stories: the best of billy connolly,Billy Connolly,none,336.0,Hachette UK,tall tales and wee stories: the best of billy connolly Billy Connolly none Hachette UK
after anna,Alex Lake,"Fiction , Mystery &amp, Detective , General",416.0,HarperCollins UK,"after anna Alex Lake Fiction , Mystery &amp, Detective , General HarperCollins UK"
the art of thinking clearly,Rolf Dobelli,none,384.0,Harper Collins,the art of thinking clearly Rolf Dobelli none Harper Collins
the complete works of william shakespeare,William Shakespeare,none,1424.0,e-artnow,the complete works of william shakespeare William Shakespeare none e-artnow
the ultimate secrets of total self-confidence,Robert Anthony,none,240.0,Penguin,the ultimate secrets of total self-confidence Robert Anthony none Penguin
financial statements: a step-by-step guide to understanding and creating financial report,Thomas Ittelson,"Business &amp, Economics , Accounting , Financial",288.0,Red Wheel/Weiser,"financial statements: a step-by-step guide to understanding and creating financial report Thomas Ittelson Business &amp, Economics , Accounting , Financial Red Wheel/Weiser"
batman: the man who laughs,Ed Brubaker,none,146.0,DC,batman: the man who laughs Ed Brubaker none DC
the rave:fantastically gritty northern crime,Edgar Allan Poe,"Fiction , Literary",32.0,Simon and Schuster,"the rave:fantastically gritty northern crime Edgar Allan Poe Fiction , Literary Simon and Schuster"
little girl lost: a lucy black thriller,Brian McGilloway,"Fiction , Mystery &amp, Detective , Women Sleuths",336.0,Harper Collins,"little girl lost: a lucy black thriller Brian McGilloway Fiction , Mystery &amp, Detective , Women Sleuths Harper Collins"
civil war,Mark Millar,"Comics &amp, Graphic Novels , Superheroes",208.0,Marvel Entertainment,"civil war Mark Millar Comics &amp, Graphic Novels , Superheroes Marvel Entertainment"
marketing (the brian tracy success library),Brian Tracy,"Business &amp, Economics , Marketing , General",112.0,AMACOM,"marketing (the brian tracy success library) Brian Tracy Business &amp, Economics , Marketing , General AMACOM"
secrets of the millionaire mind: mastering the inner game of wealth,T. Harv Eker,"Business &amp, Economics , Motivational",224.0,Harper Collins,"secrets of the millionaire mind: mastering the inner game of wealth T. Harv Eker Business &amp, Economics , Motivational Harper Collins"
bring me back,B A Paris,"Fiction , Thrillers , Crime",368.0,HarperCollins UK,"bring me back B A Paris Fiction , Thrillers , Crime HarperCollins UK"
how to understand business finance,Bob Cinnamon,"Business &amp, Economics , Corporate Finance , General",176.0,Kogan Page Publishers,"how to understand business finance Bob Cinnamon Business &amp, Economics , Corporate Finance , General Kogan Page Publishers"
no mercy: the brand new novel from the queen of crime,Martina Cole,"Fiction , Crime",416.0,Hachette UK,"no mercy: the brand new novel from the queen of crime Martina Cole Fiction , Crime Hachette UK"
the weight of honor (kings and sorcerers--book 3),Morgan Rice,"Fiction , Science Fiction , General",250.0,Morgan Rice,"the weight of honor (kings and sorcerers--book 3) Morgan Rice Fiction , Science Fiction , General Morgan Rice"
dark nights: metal: deluxe edition,Scott Snyder,none,216.0,DC Comics,dark nights: metal: deluxe edition Scott Snyder none DC Comics
the marine's e-mail order bride: (heroes of chance creek),Cora Seton,none,300.0,One Acre Press,the marine's e-mail order bride: (heroes of chance creek) Cora Seton none One Acre Press
battle sight zero,Gerald Seymour,"Fiction , Thrillers , Suspense",448.0,Hachette UK,"battle sight zero Gerald Seymour Fiction , Thrillers , Suspense Hachette UK"
predictably irrational: the hidden forces that shape our decision,Dan Ariely,none,304.0,HarperCollins UK,predictably irrational: the hidden forces that shape our decision Dan Ariely none HarperCollins UK
think like a freak: the authors of freakonomics offer to retrain your brain,Steven D. Levitt,none,304.0,Harper Collins,think like a freak: the authors of freakonomics offer to retrain your brain Steven D. Levitt none Harper Collins
sonic: tangle & whisper ,Ian Flynn,"Comics & Graphic Novels , Science Fiction",30.0,IDW Publishing,"sonic: tangle & whisper  Ian Flynn Comics & Graphic Novels , Science Fiction IDW Publishing"
assassin's apprentice,Robin Hobb,"Fiction , Fantasy , Dragons &amp, Mythical Creatures",400.0,HarperCollins UK,"assassin's apprentice Robin Hobb Fiction , Fantasy , Dragons &amp, Mythical Creatures HarperCollins UK"
"captain marvel vol. 1: higher, further, faster, more",Kelly Sue Deconnick,"Comics &amp, Graphic Novels , Superheroes",136.0,Marvel Entertainment,"captain marvel vol. 1: higher, further, faster, more Kelly Sue Deconnick Comics &amp, Graphic Novels , Superheroes Marvel Entertainment"
my little pony: the feats of friendship ,Ian Flynn,"Comics & Graphic Novels , Fantasy",30.0,IDW Publishing,"my little pony: the feats of friendship  Ian Flynn Comics & Graphic Novels , Fantasy IDW Publishing"
kings and sorcerers bundle (books 2 and 3),Morgan Rice,none,500.0,Morgan Rice,kings and sorcerers bundle (books 2 and 3) Morgan Rice none Morgan Rice
a trace of vice (a keri locke mystery--book #3),Blake Pierce,none,250.0,Blake Pierce,a trace of vice (a keri locke mystery--book #3) Blake Pierce none Blake Pierce
young justice vol.1: gemworld,Art Baltazar,"Comics &amp, Graphic Novels , Superheroes",164.0,DC,"young justice vol.1: gemworld Art Baltazar Comics &amp, Graphic Novels , Superheroes DC"
10 ways to be less consumerism,James Fries,none,15.0,EDITORA BIBLIOMUNDI SERVIÇOS DIGITAIS LTDA,10 ways to be less consumerism James Fries none EDITORA BIBLIOMUNDI SERVIÇOS DIGITAIS LTDA
team sonic racing one-shot,Caleb Goellner,"Comics & Graphic Novels , Science Fiction",52.0,IDW Publishing,"team sonic racing one-shot Caleb Goellner Comics & Graphic Novels , Science Fiction IDW Publishing"
management (the brian tracy success library),Brian Tracy,none,112.0,AMACOM,management (the brian tracy success library) Brian Tracy none AMACOM
batman and robin vol. 1: batman reborn,Grant Morrison,none,172.0,DC,batman and robin vol. 1: batman reborn Grant Morrison none DC
the black box,Michael Connelly,none,448.0,Hachette UK,the black box Michael Connelly none Hachette UK
my little pony: friendship is magic #4,Thom Zahler,"Comics & Graphic Novels , General",31.0,IDW Publishing,"my little pony: friendship is magic #4 Thom Zahler Comics & Graphic Novels , General IDW Publishing"
the joke,Brian Azzarello,none,130.0,DC,the joke Brian Azzarello none DC
platform: get noticed in a noisy world,Michael Hyatt,none,288.0,HarperCollins Leadership,platform: get noticed in a noisy world Michael Hyatt none HarperCollins Leadership
platform revolution: how networked markets are transforming the economy ,Geoffrey G. Parker,"Business &amp, Economics , New Business Enterprises",256.0,W. W. Norton & Company,"platform revolution: how networked markets are transforming the economy  Geoffrey G. Parker Business &amp, Economics , New Business Enterprises W. W. Norton & Company"
total control,David Baldacci,"Fiction , Mystery &amp, Detective , General",624.0,Pan Macmillan,"total control David Baldacci Fiction , Mystery &amp, Detective , General Pan Macmillan"
shall we tell the president,Jeffrey Archer,none,200.0,Pan Macmillan,shall we tell the president Jeffrey Archer none Pan Macmillan
15 delicious slow cooker recipe,Sallie Stone,none,18.0,BookRix,15 delicious slow cooker recipe Sallie Stone none BookRix
marvel universe vs. the punisher: volume ,Jonathan Maberry,none,112.0,Marvel Entertainment,marvel universe vs. the punisher: volume  Jonathan Maberry none Marvel Entertainment
the witcher ,Paul Tobin,"Comics & Graphic Novels , General",24.0,Dark Horse Comics (Single Issues),"the witcher  Paul Tobin Comics & Graphic Novels , General Dark Horse Comics (Single Issues)"
spider-man: anti-venom,Dan Slott,none,96.0,Marvel Entertainment,spider-man: anti-venom Dan Slott none Marvel Entertainment
kingdom of stranger,Zoe Ferraris,none,368.0,Hachette UK,kingdom of stranger Zoe Ferraris none Hachette UK
in dark company: a kate burkholder short story,Linda Castillo,none,60.0,Minotaur Books,in dark company: a kate burkholder short story Linda Castillo none Minotaur Books
freakonomics rev ed: a rogue economist explores the hidden side of everything,Steven D. Levitt,"Business &amp, Economics , Economics , Theory",336.0,Harper Collins,"freakonomics rev ed: a rogue economist explores the hidden side of everything Steven D. Levitt Business &amp, Economics , Economics , Theory Harper Collins"
moby dick. illustrated edition,Melville Herman,"Fiction , Action & Adventure",771.0,Strelbytskyy Multimedia Publishing,"moby dick. illustrated edition Melville Herman Fiction , Action & Adventure Strelbytskyy Multimedia Publishing"
selling 101: what every successful sales professional needs to know,Zig Ziglar,none,112.0,HarperCollins Leadership,selling 101: what every successful sales professional needs to know Zig Ziglar none HarperCollins Leadership
10 ways to be annoying,James Fries,none,17.0,EDITORA BIBLIOMUNDI SERVIÇOS DIGITAIS LTDA,10 ways to be annoying James Fries none EDITORA BIBLIOMUNDI SERVIÇOS DIGITAIS LTDA
the mysterious affair at style,Agatha Christie,"Fiction , Thrillers , Military",208.0,HarperCollins UK,"the mysterious affair at style Agatha Christie Fiction , Thrillers , Military HarperCollins UK"
mighty thor vol. 2: lords of midgard,Jason Aaron,"Comics &amp, Graphic Novels , Superheroes",160.0,Marvel Entertainment,"mighty thor vol. 2: lords of midgard Jason Aaron Comics &amp, Graphic Novels , Superheroes Marvel Entertainment"
home work: a memoir of my hollywood year,Julie Andrews,none,352.0,Hachette UK,home work: a memoir of my hollywood year Julie Andrews none Hachette UK
powerful phrases for dealing with difficult people: over 325 ready-to-use words and phrases for working with challenging personalities,Renee Evenson,"Business &amp, Economics , Conflict Resolution &amp, Mediation",240.0,AMACOM,"powerful phrases for dealing with difficult people: over 325 ready-to-use words and phrases for working with challenging personalities Renee Evenson Business &amp, Economics , Conflict Resolution &amp, Mediation AMACOM"
green lantern: secret origin,Geoff Johns,none,194.0,DC,green lantern: secret origin Geoff Johns none DC
and then there were none,Agatha Christie,"Fiction , Classics",224.0,HarperCollins UK,"and then there were none Agatha Christie Fiction , Classics HarperCollins UK"
the art of war (the classic lionel giles translation),Sun Tzu,"History , Military , General",80.0,e-artnow,"the art of war (the classic lionel giles translation) Sun Tzu History , Military , General e-artnow"
diabolical,Jana DeLeon,none,360.0,Jana DeLeon,diabolical Jana DeLeon none Jana DeLeon
business strategy (the brian tracy success library),Brian Tracy,none,112.0,AMACOM,business strategy (the brian tracy success library) Brian Tracy none AMACOM
personal success (the brian tracy success library),Brian Tracy,none,112.0,AMACOM,personal success (the brian tracy success library) Brian Tracy none AMACOM
the vagrant (the vagrant trilogy),Peter Newman,"Fiction , Fantasy , Epic",416.0,HarperCollins UK,"the vagrant (the vagrant trilogy) Peter Newman Fiction , Fantasy , Epic HarperCollins UK"
deadpool team-up vol. 1: good buddies,Fred Van Lente,"Comics & Graphic Novels , Superheroes",9780000000000.0,Marvel Entertainment,"deadpool team-up vol. 1: good buddies Fred Van Lente Comics & Graphic Novels , Superheroes Marvel Entertainment"
immortal hulk vol. 1: or is he both?,Al Ewing,"Comics &amp, Graphic Novels , Superheroes",128.0,Marvel Entertainment,"immortal hulk vol. 1: or is he both? Al Ewing Comics &amp, Graphic Novels , Superheroes Marvel Entertainment"
blood runs cold: a completely unputdownable mystery and suspense thriller,Dylan Young,"Fiction , Thrillers , Suspense",350.0,Bookouture,"blood runs cold: a completely unputdownable mystery and suspense thriller Dylan Young Fiction , Thrillers , Suspense Bookouture"
"the lord of the rings: the fellowship of the ring, the two towers, the return of the king",J. R. R. Tolkien,"Fiction , Fairy Tales, Folk Tales, Legends &amp, Mythology",1216.0,HarperCollins UK,"the lord of the rings: the fellowship of the ring, the two towers, the return of the king J. R. R. Tolkien Fiction , Fairy Tales, Folk Tales, Legends &amp, Mythology HarperCollins UK"
the walking dead: compendium ,Robert Kirkman,none,28.0,"Image Comics, Inc.","the walking dead: compendium  Robert Kirkman none Image Comics, Inc."
the call of cthulhu,H. P. Lovecraft,"Fiction , Horror",49.0,BookRix,"the call of cthulhu H. P. Lovecraft Fiction , Horror BookRix"
civil engineering guide for gate/ psus,Disha Experts,none,363.0,Disha Publications,civil engineering guide for gate/ psus Disha Experts none Disha Publications
batman: arkham knight,Peter J. Tomasi,none,200.0,DC,batman: arkham knight Peter J. Tomasi none DC
the essentials of finance and accounting for nonfinancial managers,Edward Fields,"Business &amp, Economics , Budgeting",320.0,AMACOM,"the essentials of finance and accounting for nonfinancial managers Edward Fields Business &amp, Economics , Budgeting AMACOM"
the law of success ,Napoleon Hill,none,547.0,Simon and Schuster,the law of success  Napoleon Hill none Simon and Schuster
watchmen (2019 edition),Alan Moore,none,448.0,DC Comics,watchmen (2019 edition) Alan Moore none DC Comics
"business process management: concepts, languages, architectures",Mathias Weske,"Computers , Electronic Commerce",404.0,Springer Science & Business Media,"business process management: concepts, languages, architectures Mathias Weske Computers , Electronic Commerce Springer Science & Business Media"
spider-verse,Dan Slott,"Comics &amp, Graphic Novels , Superheroes",624.0,Marvel Entertainment,"spider-verse Dan Slott Comics &amp, Graphic Novels , Superheroes Marvel Entertainment"
spider-man: kraven's last hunt,J. M. DeMatteis,"Comics &amp, Graphic Novels , Superheroes",168.0,Marvel Entertainment,"spider-man: kraven's last hunt J. M. DeMatteis Comics &amp, Graphic Novels , Superheroes Marvel Entertainment"
the umbrella academy: apocalypse suite ,Gerard Way,"Comics & Graphic Novels , General",23.0,Dark Horse Comics (Single Issues),"the umbrella academy: apocalypse suite  Gerard Way Comics & Graphic Novels , General Dark Horse Comics (Single Issues)"
venomize,Cullen Bunn,none,136.0,Marvel Entertainment,venomize Cullen Bunn none Marvel Entertainment
sonic the hedgehog,Ian Flynn,"Comics & Graphic Novels , Science Fiction",36.0,IDW Publishing,"sonic the hedgehog Ian Flynn Comics & Graphic Novels , Science Fiction IDW Publishing"
psychoanalysis for beginners: a general introduction to psychoanalysis and dream psychology,Sigmund Freud,"Psychology , Movements , Psychoanalysis",160.0,e-artnow,"psychoanalysis for beginners: a general introduction to psychoanalysis and dream psychology Sigmund Freud Psychology , Movements , Psychoanalysis e-artnow"
the secrets of saving and investing with alvin hall: simple strategies to make your money go further,Alvin Hall,"Business &amp, Economics , Personal Finance , Budgeting",30.0,Hachette UK,"the secrets of saving and investing with alvin hall: simple strategies to make your money go further Alvin Hall Business &amp, Economics , Personal Finance , Budgeting Hachette UK"
forever evil,Geoff Johns,none,240.0,DC,forever evil Geoff Johns none DC
the punisher vol. 1: black and white,Natahan Edmondson,"Comics &amp, Graphic Novels , Superheroes",136.0,Marvel Entertainment,"the punisher vol. 1: black and white Natahan Edmondson Comics &amp, Graphic Novels , Superheroes Marvel Entertainment"
mega man,Ian Flynn,"Juvenile Fiction , Humorous Stories",25.0,Archie Comic Publications,"mega man Ian Flynn Juvenile Fiction , Humorous Stories Archie Comic Publications"
sonic the hedgehog ,Ian Flynn,"Comics & Graphic Novels , Science Fiction",34.0,IDW Publishing,"sonic the hedgehog  Ian Flynn Comics & Graphic Novels , Science Fiction IDW Publishing"
marvel universe: the end,Jim Starlin,none,168.0,Marvel Entertainment,marvel universe: the end Jim Starlin none Marvel Entertainment
batman: arkham unhinged,Derek Fridolfs,none,160.0,DC,batman: arkham unhinged Derek Fridolfs none DC
the witcher ,Paul Tobin,"Comics & Graphic Novels , General",24.0,Dark Horse Comics (Single Issues),"the witcher  Paul Tobin Comics & Graphic Novels , General Dark Horse Comics (Single Issues)"
invincible ,Robert Kirkman,"Comics & Graphic Novels , Superheroes",32.0,Image Comics,"invincible  Robert Kirkman Comics & Graphic Novels , Superheroes Image Comics"
all-new wolverine vol. 1: the four sister,Tom Taylor,none,136.0,Marvel Entertainment,all-new wolverine vol. 1: the four sister Tom Taylor none Marvel Entertainment
a trace of crime (a keri locke mystery--book #4),Blake Pierce,"Fiction , Mystery & Detective , General",250.0,Blake Pierce,"a trace of crime (a keri locke mystery--book #4) Blake Pierce Fiction , Mystery & Detective , General Blake Pierce"
the jumanji,Doug Johnstone,none,304.0,Faber & Faber,the jumanji Doug Johnstone none Faber & Faber
the last of us: american dreams ,Faith Erin Hicks,"Comics & Graphic Novels , General",26.0,Dark Horse Comics (Single Issues),"the last of us: american dreams  Faith Erin Hicks Comics & Graphic Novels , General Dark Horse Comics (Single Issues)"
the walking dead #18,Robert Kirkman,"Comics & Graphic Novels , Horror",56.0,Image Comics,"the walking dead #18 Robert Kirkman Comics & Graphic Novels , Horror Image Comics"
injustice: gods among us year one - the complete collection,Tom Taylor,none,400.0,DC,injustice: gods among us year one - the complete collection Tom Taylor none DC
leadership 101: what every leader needs to know,John C. Maxwell,none,128.0,HarperCollins Leadership,leadership 101: what every leader needs to know John C. Maxwell none HarperCollins Leadership
the complete art of war,Sun Tzu,"Political Science , Political Ideologies , General",667.0,Simon and Schuster,"the complete art of war Sun Tzu Political Science , Political Ideologies , General Simon and Schuster"
(free sample) ctet english & hindi language 9 year-wise solved papers 1 & 2,Disha Experts,none,23.0,Disha Publications,(free sample) ctet english & hindi language 9 year-wise solved papers 1 & 2 Disha Experts none Disha Publications
1 sample paper for cbse class 10 science 2020 exam,Disha Experts,none,25.0,Disha Publications,1 sample paper for cbse class 10 science 2020 exam Disha Experts none Disha Publications
(free sample) super 10 sample papers for cbse class 10 english language literature 2nd edition,Disha Experts,none,33.0,Disha Publications,(free sample) super 10 sample papers for cbse class 10 english language literature 2nd edition Disha Experts none Disha Publications
fundamentals of wavelet,"Goswami, Jaideva",signal_processing,228.0,Wiley,"fundamentals of wavelet Goswami, Jaideva signal_processing Wiley"
data smart,"Foreman, John",data_science,235.0,Wiley,"data smart Foreman, John data_science Wiley"
god created the integer,"Hawking, Stephen",mathematics,197.0,Penguin,"god created the integer Hawking, Stephen mathematics Penguin"
superfreakonomic,"Dubner, Stephen",economics,179.0,HarperCollins,"superfreakonomic Dubner, Stephen economics HarperCollins"
orientalism,"Said, Edward",history,197.0,Penguin,"orientalism Said, Edward history Penguin"
nature of statistical learning theory,"Vapnik, Vladimir",data_science,230.0,Springer,"nature of statistical learning theory Vapnik, Vladimir data_science Springer"
integration of the indian state,"Menon, V P",history,217.0,Orient Blackswan,"integration of the indian state Menon, V P history Orient Blackswan"
the drunkard's walk,"Mlodinow, Leonard",science,197.0,Penguin,"the drunkard's walk Mlodinow, Leonard science Penguin"
image processing & mathematical morphology,"Shih, Frank",signal_processing,241.0,CRC,"image processing & mathematical morphology Shih, Frank signal_processing CRC"
how to think like sherlock holmes,"Konnikova, Maria",psychology,240.0,Penguin,"how to think like sherlock holmes Konnikova, Maria psychology Penguin"
data scientists at work,Sebastian Gutierrez,data_science,230.0,Apress,data scientists at work Sebastian Gutierrez data_science Apress
slaughterhouse five,"Vonnegut, Kurt",fiction,198.0,Random House,"slaughterhouse five Vonnegut, Kurt fiction Random House"
birth of a theorem,"Villani, Cedric",mathematics,234.0,Bodley Head,"birth of a theorem Villani, Cedric mathematics Bodley Head"
structure & interpretation of computer program,"Sussman, Gerald",computer_science,240.0,MIT Press,"structure & interpretation of computer program Sussman, Gerald computer_science MIT Press"
the age of wrath: a history of the delhi sultanate,"Eraly, Abraham",history,238.0,Penguin,"the age of wrath: a history of the delhi sultanate Eraly, Abraham history Penguin"
